{
  "case_id": "m6b.func.lh.006",
  "category": "long_context_handoff",
  "dataset_ref": {
    "dataset_hash": "sha256:b7964bf75082d712bc2a4427694b60591cfe2b10445d1ed43db46fc8da6f6f74",
    "dataset_id": "flowpilot-m0-evaluation",
    "dataset_version": "1.0.0-rc.2"
  },
  "deterministic_assertions": [
    {
      "assertion_id": "assert.task.terminal_status.v1",
      "parameters": {
        "expected": "COMPLETED"
      }
    },
    {
      "assertion_id": "assert.tool.allowed.v1",
      "parameters": {
        "tools": [
          "itsm.ticket.create.v1"
        ]
      }
    },
    {
      "assertion_id": "assert.tool.write_count.v1",
      "parameters": {
        "maximum": 1
      }
    },
    {
      "assertion_id": "assert.context.within_budget.v1",
      "parameters": {
        "maximum_input_tokens": 4096
      }
    },
    {
      "assertion_id": "assert.handoff.fields_allowed.v1",
      "parameters": {
        "allowed_fields": [
          "ticket_id",
          "priority"
        ]
      }
    }
  ],
  "expected": {
    "allowed_tools": [
      "itsm.ticket.create.v1"
    ],
    "forbidden_tools": [
      "itsm.approval.grant.v1",
      "itsm.change.create.v1",
      "itsm.ticket.update.v1"
    ],
    "intent": "long_context_handoff",
    "required_clarifications": [],
    "requires_approval": true,
    "terminal_status": "COMPLETED"
  },
  "fault_injection": null,
  "feature_ids": [
    "FP-EVAL-001"
  ],
  "fixture_bundle_ref": {
    "fixture_hash": "sha256:e4f0092d40cac57d9a5a06373d79f96fc9d18918cee1b57ae12daf8518a7416c",
    "fixture_id": "flowpilot-m0-fixtures",
    "fixture_version": "1.0.0-rc.2"
  },
  "input": [
    {
      "content": "LAP-000123 最近网络总是不稳定。",
      "role": "user"
    },
    {
      "content": "请描述现象，我好判断是硬件还是网络问题。",
      "role": "assistant"
    },
    {
      "content": "有线无线都连不上，其他设备正常。",
      "role": "user"
    },
    {
      "content": "这符合单机网络故障特征，建议按事件工单上报。",
      "role": "assistant"
    },
    {
      "content": "环境是 prod，优先级 P2，帮我创建事件工单。",
      "role": "user"
    },
    {
      "content": "已按上述信息创建事件工单，长对话上下文未超出预算。",
      "role": "assistant"
    }
  ],
  "judge_rubrics": [],
  "principal_fixture": "principal-basic-user",
  "registry_ref": {
    "registry_hash": "sha256:8fd1161693765b49ded77a8865af1c2f886be97294df41ae45d7770da0244335",
    "registry_id": "flowpilot-evaluation-registry",
    "registry_version": "1.0.0-rc.2"
  },
  "suite": "functional",
  "tags": [
    "offline",
    "synthetic",
    "scenario:long_discussion_then_write",
    "source:synthetic-ticket-store-v1"
  ],
  "tenant_fixture": "tenant-a"
}
