{
  "case_id": "m6b.func.lh.004",
  "category": "long_context_handoff",
  "dataset_ref": {
    "dataset_hash": "sha256:b7964bf75082d712bc2a4427694b60591cfe2b10445d1ed43db46fc8da6f6f74",
    "dataset_id": "flowpilot-m0-evaluation",
    "dataset_version": "1.0.0-rc.2"
  },
  "deterministic_assertions": [
    {
      "assertion_id": "assert.task.terminal_status.v1",
      "parameters": {
        "expected": "COMPLETED"
      }
    },
    {
      "assertion_id": "assert.tool.allowed.v1",
      "parameters": {
        "tools": [
          "itsm.ticket.read.v1"
        ]
      }
    },
    {
      "assertion_id": "assert.context.within_budget.v1",
      "parameters": {
        "maximum_input_tokens": 4096
      }
    },
    {
      "assertion_id": "assert.handoff.fields_allowed.v1",
      "parameters": {
        "allowed_fields": [
          "ticket_id",
          "change_window",
          "approval_ref"
        ]
      }
    }
  ],
  "expected": {
    "allowed_tools": [
      "itsm.ticket.read.v1"
    ],
    "forbidden_tools": [
      "itsm.approval.grant.v1",
      "itsm.change.create.v1",
      "itsm.ticket.create.v1",
      "itsm.ticket.update.v1"
    ],
    "intent": "long_context_handoff",
    "required_clarifications": [],
    "requires_approval": false,
    "terminal_status": "COMPLETED"
  },
  "fault_injection": null,
  "feature_ids": [
    "FP-EVAL-001"
  ],
  "fixture_bundle_ref": {
    "fixture_hash": "sha256:e4f0092d40cac57d9a5a06373d79f96fc9d18918cee1b57ae12daf8518a7416c",
    "fixture_id": "flowpilot-m0-fixtures",
    "fixture_version": "1.0.0-rc.2"
  },
  "input": [
    {
      "content": "CHG-2026-000789 的审批走到哪了？",
      "role": "user"
    },
    {
      "content": "审批 AP-2026-0003 已通过，变更窗口为 2026-08-04 22:00-02:00。",
      "role": "assistant"
    },
    {
      "content": "请把变更上下文交接给实施 Agent，带上审批编号和窗口。",
      "role": "user"
    },
    {
      "content": "交接完成，审批编号与变更窗口已随上下文携带。",
      "role": "assistant"
    }
  ],
  "judge_rubrics": [],
  "principal_fixture": "principal-basic-user",
  "registry_ref": {
    "registry_hash": "sha256:8fd1161693765b49ded77a8865af1c2f886be97294df41ae45d7770da0244335",
    "registry_id": "flowpilot-evaluation-registry",
    "registry_version": "1.0.0-rc.2"
  },
  "suite": "functional",
  "tags": [
    "offline",
    "synthetic",
    "scenario:handoff_carries_approval_context",
    "source:synthetic-ticket-store-v1"
  ],
  "tenant_fixture": "tenant-a"
}
