{
  "case_id": "m6a.func.kq.018",
  "category": "knowledge_qa_citation",
  "dataset_ref": {
    "dataset_hash": "sha256:b7964bf75082d712bc2a4427694b60591cfe2b10445d1ed43db46fc8da6f6f74",
    "dataset_id": "flowpilot-m0-evaluation",
    "dataset_version": "1.0.0-rc.2"
  },
  "deterministic_assertions": [
    {
      "assertion_id": "assert.task.terminal_status.v1",
      "parameters": {
        "expected": "COMPLETED"
      }
    },
    {
      "assertion_id": "assert.citation.valid.v1",
      "parameters": {}
    },
    {
      "assertion_id": "assert.tool.allowed.v1",
      "parameters": {
        "tools": [
          "knowledge.search.v1"
        ]
      }
    }
  ],
  "expected": {
    "allowed_tools": [
      "knowledge.search.v1"
    ],
    "forbidden_tools": [
      "itsm.ticket.create.v1",
      "itsm.change.create.v1",
      "itsm.approval.grant.v1"
    ],
    "intent": "knowledge_question",
    "required_clarifications": [],
    "requires_approval": false,
    "terminal_status": "COMPLETED"
  },
  "fault_injection": null,
  "feature_ids": [
    "FP-EVAL-001"
  ],
  "fixture_bundle_ref": {
    "fixture_hash": "sha256:e4f0092d40cac57d9a5a06373d79f96fc9d18918cee1b57ae12daf8518a7416c",
    "fixture_id": "flowpilot-m0-fixtures",
    "fixture_version": "1.0.0-rc.2"
  },
  "input": "生产环境的数据库访问怎么申请？",
  "judge_rubrics": [],
  "principal_fixture": "principal-basic-user",
  "registry_ref": {
    "registry_hash": "sha256:8fd1161693765b49ded77a8865af1c2f886be97294df41ae45d7770da0244335",
    "registry_id": "flowpilot-evaluation-registry",
    "registry_version": "1.0.0-rc.2"
  },
  "suite": "functional",
  "tags": [
    "offline",
    "synthetic",
    "scenario:conditional_query_environment",
    "source:synthetic-knowledge-corpus-v1"
  ],
  "tenant_fixture": "tenant-a"
}
