{
  "case_id": "m6c.func.lh.009",
  "category": "long_context_handoff",
  "dataset_ref": {
    "dataset_hash": "sha256:b7964bf75082d712bc2a4427694b60591cfe2b10445d1ed43db46fc8da6f6f74",
    "dataset_id": "flowpilot-m0-evaluation",
    "dataset_version": "1.0.0-rc.2"
  },
  "deterministic_assertions": [
    {
      "assertion_id": "assert.task.terminal_status.v1",
      "parameters": {
        "expected": "FAILED"
      }
    },
    {
      "assertion_id": "assert.context.within_budget.v1",
      "parameters": {
        "maximum_input_tokens": 4096
      }
    },
    {
      "assertion_id": "assert.handoff.fields_allowed.v1",
      "parameters": {
        "allowed_fields": [
          "ticket_id",
          "status"
        ]
      }
    }
  ],
  "expected": {
    "allowed_tools": [],
    "forbidden_tools": [
      "itsm.approval.grant.v1",
      "itsm.change.create.v1",
      "itsm.ticket.create.v1",
      "itsm.ticket.update.v1"
    ],
    "intent": "long_context_handoff",
    "required_clarifications": [],
    "requires_approval": false,
    "terminal_status": "FAILED"
  },
  "fault_injection": null,
  "feature_ids": [
    "FP-EVAL-001"
  ],
  "fixture_bundle_ref": {
    "fixture_hash": "sha256:e4f0092d40cac57d9a5a06373d79f96fc9d18918cee1b57ae12daf8518a7416c",
    "fixture_id": "flowpilot-m0-fixtures",
    "fixture_version": "1.0.0-rc.2"
  },
  "input": [
    {
      "content": "工单类型有哪几种？",
      "role": "user"
    },
    {
      "content": "事件、服务请求、变更三大类，另有问题与发布类目。",
      "role": "assistant"
    },
    {
      "content": "事件工单的严重级别怎么分？",
      "role": "user"
    },
    {
      "content": "Sev1 到 Sev4，Sev1 为核心业务中断。",
      "role": "assistant"
    },
    {
      "content": "SLA 里 P1 的响应承诺是多少？",
      "role": "user"
    },
    {
      "content": "P1 响应目标 5 分钟，解决目标视级别而定。",
      "role": "assistant"
    },
    {
      "content": "变更窗口外可以发布吗？",
      "role": "user"
    },
    {
      "content": "窗口外需要走紧急变更并补齐审批。",
      "role": "assistant"
    },
    {
      "content": "审批阈值是多少？",
      "role": "user"
    },
    {
      "content": "影响 120 用户以上需要审批。",
      "role": "assistant"
    },
    {
      "content": "LAP-000123 关联哪些事件？",
      "role": "user"
    },
    {
      "content": "最近一次为网络接入异常，已按 Sev2 记录。",
      "role": "assistant"
    },
    {
      "content": "继续，把上下文交接给下一处理人。",
      "role": "user"
    }
  ],
  "judge_rubrics": [],
  "principal_fixture": "principal-basic-user",
  "registry_ref": {
    "registry_hash": "sha256:8fd1161693765b49ded77a8865af1c2f886be97294df41ae45d7770da0244335",
    "registry_id": "flowpilot-evaluation-registry",
    "registry_version": "1.0.0-rc.2"
  },
  "suite": "functional",
  "tags": [
    "offline",
    "synthetic",
    "scenario:cumulative_input_over_budget_blocked",
    "source:synthetic-ticket-store-v1"
  ],
  "tenant_fixture": "tenant-a"
}
