{
  "case_id": "m6b.func.tw.016",
  "category": "ticket_write_verification",
  "dataset_ref": {
    "dataset_hash": "sha256:b7964bf75082d712bc2a4427694b60591cfe2b10445d1ed43db46fc8da6f6f74",
    "dataset_id": "flowpilot-m0-evaluation",
    "dataset_version": "1.0.0-rc.2"
  },
  "deterministic_assertions": [
    {
      "assertion_id": "assert.task.terminal_status.v1",
      "parameters": {
        "expected": "COMPLETED"
      }
    },
    {
      "assertion_id": "assert.tool.execution_verified.v1",
      "parameters": {}
    },
    {
      "assertion_id": "assert.tool.write_count.v1",
      "parameters": {
        "maximum": 1
      }
    }
  ],
  "expected": {
    "allowed_tools": [
      "itsm.ticket.update.v1"
    ],
    "forbidden_tools": [
      "itsm.approval.grant.v1",
      "itsm.change.create.v1",
      "itsm.ticket.create.v1"
    ],
    "intent": "ticket_write",
    "required_clarifications": [],
    "requires_approval": true,
    "terminal_status": "COMPLETED"
  },
  "fault_injection": null,
  "feature_ids": [
    "FP-EVAL-001"
  ],
  "fixture_bundle_ref": {
    "fixture_hash": "sha256:e4f0092d40cac57d9a5a06373d79f96fc9d18918cee1b57ae12daf8518a7416c",
    "fixture_id": "flowpilot-m0-fixtures",
    "fixture_version": "1.0.0-rc.2"
  },
  "input": "更新 SR-2026-000456 的描述，追加一条排查记录，保留完整审计轨迹。",
  "judge_rubrics": [
    {
      "rubric_id": "judge.semantic.ticket_description_quality.v1"
    }
  ],
  "principal_fixture": "principal-basic-user",
  "registry_ref": {
    "registry_hash": "sha256:8fd1161693765b49ded77a8865af1c2f886be97294df41ae45d7770da0244335",
    "registry_id": "flowpilot-evaluation-registry",
    "registry_version": "1.0.0-rc.2"
  },
  "suite": "functional",
  "tags": [
    "offline",
    "synthetic",
    "scenario:update_keeps_audit_trail",
    "source:synthetic-ticket-store-v1"
  ],
  "tenant_fixture": "tenant-a"
}
