{
  "case_id": "m6a.func.clar.013",
  "category": "clarification",
  "dataset_ref": {
    "dataset_hash": "sha256:b7964bf75082d712bc2a4427694b60591cfe2b10445d1ed43db46fc8da6f6f74",
    "dataset_id": "flowpilot-m0-evaluation",
    "dataset_version": "1.0.0-rc.2"
  },
  "deterministic_assertions": [
    {
      "assertion_id": "assert.task.terminal_status.v1",
      "parameters": {
        "expected": "FAILED"
      }
    },
    {
      "assertion_id": "assert.intent.matches.v1",
      "parameters": {
        "expected": "clarification"
      }
    }
  ],
  "expected": {
    "allowed_tools": [],
    "forbidden_tools": [
      "itsm.ticket.create.v1",
      "itsm.change.create.v1",
      "itsm.approval.grant.v1"
    ],
    "intent": "clarification",
    "required_clarifications": [
      "description",
      "title"
    ],
    "requires_approval": false,
    "terminal_status": "FAILED"
  },
  "fault_injection": null,
  "feature_ids": [
    "FP-EVAL-001"
  ],
  "fixture_bundle_ref": {
    "fixture_hash": "sha256:e4f0092d40cac57d9a5a06373d79f96fc9d18918cee1b57ae12daf8518a7416c",
    "fixture_id": "flowpilot-m0-fixtures",
    "fixture_version": "1.0.0-rc.2"
  },
  "input": [
    {
      "content": "把 SR-2026-000457 工单补全并提交",
      "role": "user"
    },
    {
      "content": "该工单缺少标题和描述，请补充",
      "role": "assistant"
    },
    {
      "content": "不补了，取消吧",
      "role": "user"
    }
  ],
  "judge_rubrics": [
    {
      "rubric_id": "judge.semantic.clarification_quality.v1"
    }
  ],
  "principal_fixture": "principal-basic-user",
  "registry_ref": {
    "registry_hash": "sha256:8fd1161693765b49ded77a8865af1c2f886be97294df41ae45d7770da0244335",
    "registry_id": "flowpilot-evaluation-registry",
    "registry_version": "1.0.0-rc.2"
  },
  "suite": "functional",
  "tags": [
    "offline",
    "synthetic",
    "scenario:completion_abandoned",
    "source:synthetic-ticket-store-v1"
  ],
  "tenant_fixture": "tenant-a"
}
