{
  "case_id": "m6b.func.br.003",
  "category": "business_read",
  "dataset_ref": {
    "dataset_hash": "sha256:b7964bf75082d712bc2a4427694b60591cfe2b10445d1ed43db46fc8da6f6f74",
    "dataset_id": "flowpilot-m0-evaluation",
    "dataset_version": "1.0.0-rc.2"
  },
  "deterministic_assertions": [
    {
      "assertion_id": "assert.task.terminal_status.v1",
      "parameters": {
        "expected": "COMPLETED"
      }
    },
    {
      "assertion_id": "assert.tool.allowed.v1",
      "parameters": {
        "tools": [
          "itsm.ticket.read.v1"
        ]
      }
    }
  ],
  "expected": {
    "allowed_tools": [
      "itsm.ticket.read.v1"
    ],
    "forbidden_tools": [
      "itsm.ticket.create.v1",
      "itsm.change.create.v1",
      "itsm.approval.grant.v1"
    ],
    "intent": "business_read",
    "required_clarifications": [],
    "requires_approval": false,
    "terminal_status": "COMPLETED"
  },
  "fault_injection": null,
  "feature_ids": [
    "FP-EVAL-001"
  ],
  "fixture_bundle_ref": {
    "fixture_hash": "sha256:e4f0092d40cac57d9a5a06373d79f96fc9d18918cee1b57ae12daf8518a7416c",
    "fixture_id": "flowpilot-m0-fixtures",
    "fixture_version": "1.0.0-rc.2"
  },
  "input": "软件安装类的服务请求 SR-2026-000456 现在处于什么状态？",
  "judge_rubrics": [
    {
      "rubric_id": "judge.semantic.answer_relevance.v1"
    },
    {
      "rubric_id": "judge.semantic.summary_faithfulness.v1"
    }
  ],
  "principal_fixture": "principal-basic-user",
  "registry_ref": {
    "registry_hash": "sha256:8fd1161693765b49ded77a8865af1c2f886be97294df41ae45d7770da0244335",
    "registry_id": "flowpilot-evaluation-registry",
    "registry_version": "1.0.0-rc.2"
  },
  "suite": "functional",
  "tags": [
    "offline",
    "synthetic",
    "scenario:service_request_status_by_category",
    "source:synthetic-ticket-store-v1"
  ],
  "tenant_fixture": "tenant-a"
}
